page,id,title,main_reference_number,has_not_been_viewed_much,date_start,date_end,date_display,artist_display,place_of_origin,exhibition_history,colorfulness,department_title,artist_title,style_title,classification_title
9,34698,Woman in an Armchair,1927.545,False,1916.0,1916.0,1916,"Pablo Picasso
Spanish, 1881-1973",Spain,"The Art Institute of Chicago, ""A Century of Progress Exhibition,"" June 1–November 1, 1933, cat. 1046, as Musical Instruments (Cubist).

The Art Institute of Chicago, ""The Sixteenth International Exhibition: Water Colors, Pastels, Drawings and Monotypes,"" March 18–May 16, 1937, cat. 122, as Still Life: Musical Instruments.

The Art Institute of Chicago, ""Picasso in Chicago,"" February 3–March 31, 1968, pp. 56, 70, and 116, cat. 76 (ill.).

New York, Saidenberg Gallery, ""Homage to Picasso,"" October 1971, p. 34, cat. 21 (ill.).

Bielefeld, Germany, Kunsthalle Bielefeld, ""Zeichnungen und Collagen des Kubismus-Picasso-Braque-Gris,"" March 11–April 29, 1979, cat. 129 (ill.), as Musical instruments; Woman in an armchair.

New York, Pace Gallery, ""Je suis le cahier: The Sketchbooks of Pablo Picasso,"" 1986, hors cat.; shown only at The Art Institute of Chicago, July 10–August 23, 1987.

Art Institute of Chicago, ""Picasso and Chicago"", February 20-May 12, 2013, hors cat.",45.3209,Prints and Drawings,Pablo Picasso,Cubism,watercolor
9,33324,"Blind Minotaur Led by Little Girl with Flowers, from the Suite Vollard",1970.150,False,1934.0,1934.0,"September 22, 1934, printed 1939","Pablo Picasso (Spanish, 1881-1973)
printed by Roger Lacourière (French, 1892-1966)
published by Ambroise Vollard (French, 1867-1939)",Spain,,7.7956,Prints and Drawings,Pablo Picasso,Cubism,drypoint
9,31978,Colophon from Poèmes et Lithographies,RX7243/1,False,1949.0,1949.0,"1949, published December 1954","Pablo Picasso (Spanish, 1881-1973)
printed by Mourlot Frères, Paris
published by Galerie Louise Leiris, Paris",Spain,,9.9661,Prints and Drawings,Pablo Picasso,Cubism,letterpress
9,31975,Page of Sketches (Heads of Children and Horses),1969.393,False,1945.0,1945.0,"December 4, 1945","Pablo Picasso
Spanish, 1881-1973",Spain,,22.9506,Prints and Drawings,Pablo Picasso,Cubism,lithograph
9,31967,"Blind Minotaur Led in the Night by a Little Girl with a Pigeon, from the Suite Vollard",1969.392,False,1934.0,1934.0,"October 23, 1934","Pablo Picasso (Spanish, 1881-1973)
printed by Roger Lacourière (French, 1892-1966)
published by Ambroise Vollard (French, 1867-1939)",Spain,,10.0828,Prints and Drawings,Pablo Picasso,Cubism,etching
9,30993,"Minotaure in Love with a Woman Centaur, from the Suite Vollard",1969.32,False,1933.0,1933.0,"May 23, 1933, reworked 1934, printed 1939","Pablo Picasso (Spanish, 1881-1973)
printed by Roger Lacourière (French, 1892-1966)
published by Ambroise Vollard (French, 1867-1939)",Spain,,12.346,Prints and Drawings,Pablo Picasso,Cubism,print
9,30988,"Blind Minotaur Led by a Little Girl with a Pigeon, from the Suite Vollard",1969.31,False,1934.0,1934.0,"November 4, 1934","Pablo Picasso (Spanish, 1881-1973)
printed by Roger Lacourière (French, 1892-1966)
published by Ambroise Vollard (French, 1867-1939)",Spain,,9.5106,Prints and Drawings,Pablo Picasso,Cubism,print
9,29944,David and Bathsheba,1968.473,False,1947.0,1947.0,"March 30, 1947","Pablo Picasso (Spanish, 1881-1973)
after Lucas Cranach, the Edler (German, 1472-1553)",Spain,,21.3454,Prints and Drawings,Pablo Picasso,Cubism,lithograph
9,29909,Study for La Coiffure,1968.463,False,1906.0,1906.0,1906,"Pablo Picasso
Spanish, 1881-1973",Spain,"New York, Saidenberg Gallery, ""Homage to Picasso,"" October 1971, cat. 3 (ill.).

Cambridge, Fogg Art Museum, Harvard University, ""Master Drawings by Picasso,"" 1981, p. 253, no. 5; shown only at The Art Institute of Chicago, April 29–June 14, 1981.

Tübingen, Germany, Kunsthalle Tübingen, ""Picasso: Pastelle, Zeichnungen, Aquarelle,"" April 5–June 1, 1986, cat. 30 (ill); traveled to the Kunstsammlung Nordrhein-Westfalen, Düsseldorf, June 14–July 27, 1986.

Art Institute of Chicago, ""Picasso and Chicago"", February 20-May 12, 2013, p. 37, cat. 22 (ill.), cat. by Stephanie d'Alessandro.",22.6018,Prints and Drawings,Pablo Picasso,Cubism,pen and ink drawings
9,29123,"Marie-Thérèse as Female Bullfighter, from the Suite Vollard",1968.190,False,1934.0,1934.0,"June 20, 1934","Pablo Picasso (Spanish, 1881-1973)
printed by Roger Lacourière (French, 1892-1966)
published by Ambroise Vollard (French, 1867-1939)",Spain,,9.2471,Prints and Drawings,Pablo Picasso,Cubism,print
9,29121,"The Cavalier, from Quatre Lithographies",1968.189,False,1921.0,1921.0,"March 7, 1921, published April 1923","Pablo Picasso (Spanish, 1881-1973)
printed by Bruant",Spain,,12.9127,Prints and Drawings,Pablo Picasso,Cubism,lithograph
9,28884,"Fragment of ""Mother and Child""",1968.100,False,1921.0,1921.0,1921,"Pablo Picasso
Spanish, active France, 1881–1973",Spain,"Paris, Musée Picasso, Olga Picasso, Mar. 21–Sept. 3, 2017, cat. 164.",42.9143,Modern Art,Pablo Picasso,Return to Order,painting
9,28773,"Coupling I, from the Suite Vollard",1968.63,False,1933.0,1933.0,"November 2, 1933, printed 1939","Pablo Picasso (Spanish, 1881-1973)
printed by Roger Lacourière (French, 1892-1966)
published by Ambroise Vollard (French, 1867-1939)",Spain,,10.3597,Prints and Drawings,Pablo Picasso,Cubism,aquatint
9,28769,"Bacchic Scene with Minotaur, from the Suite Vollard",1968.62,False,1933.0,1933.0,"May 18, 1933, printed 1939","Pablo Picasso (Spanish, 1881-1973)
printed by Roger Lacourière (French, 1892-1966)
published by Ambroise Vollard (French, 1867-1939)",Spain,,12.0685,Prints and Drawings,Pablo Picasso,Cubism,print
9,28067,The Old Guitarist,1926.253,False,1903.0,1904.0,late 1903–early 1904,"Pablo Picasso
Spanish, active France, 1881–1973",Spain,"Probably Paris, Galerie Vollard, Exposition Picasso, Dec. 1910–Feb. 1911, no cat.

New York, Carroll Galleries, Third Exhibition of Contemporary French Art, Mar. 8–Apr. 3, 1915, cat. 3, as The Guitarrist [sic].

Chicago, Arts Club, Paintings by Pablo Picasso, Mar. 26–Apr. 9, 1930, cat. 6, as Le Guitariste, about 1910.

Chicago, Art Institute, A Century of Progress Exhibition of Paintings and Sculpture, June 1–Nov. 1, 1933, cat. 402, as The Guitarist, 1903.

Hartford, Conn., Wadsworth Atheneum, Pablo Picasso, Feb. 6–Mar. 1, 1934, cat. 11 (ill.), as Vieux Guitariste, 1903.

Chicago, Art Institute, Century of Progress Exhibition of Paintings and Sculpture, June 1–Nov. 1, 1934, cat. 358, as The Guitarist, 1903.

New York, Jacques Seligmann and Company, Picasso: “Blue” and “Rose” Periods, 1901–1906, Nov. 2–26, 1936, cat. 15 (ill.), as The Old Guitar Player (The Guitarist), Barcelona, 1903.

New York, Museum of Modern Art, Picasso: Forty Years of His Art, Nov. 15, 1939–Jan. 7, 1940, cat. 20 (ill.); traveled to Chicago, Art Institute, Feb. 1–Mar. 3, 1940; St. Louis, City Art Museum, Mar. 17–Apr. 14, 1940; Boston, Museum of Art, Apr. 26–May 25, 1940; San Francisco Museum of Art, June 25–July 22, 1940; Cincinnati Museum of Art, Sept. 28–Oct. 27, 1940; Cleveland Museum of Art, Nov. 7–Dec. 8, 1940; New Orleans, Isaac Delgado Museum, Dec. 20, 1940–Jan. 17, 1941; Pittsburgh, Department of Fine Arts, Carnegie Institute, Mar. 17–Apr. 13, 1941, as The Old Guitarist, Barcelona, 1903 (New York, Chicago, and possibly St. Louis only).

Chicago, Art Institute, Gallery of Art Interpretation: Presenting the Art Institute's Picassos, Sept. 12–Dec. 15, 1955, no cat.

Chicago, Art Institute, Picasso in Chicago: Paintings, Drawings, and Prints from Chicago Collections, Feb. 3–Mar. 31, 1968, cat. 7 (ill.).

New York, Metropolitan Museum of Art, Cézanne to Picasso: Ambroise Vollard, Patron of the Avant-Garde, Sept. 13, 2006–Jan. 7, 2007, cat. 148 (ill.), as The Old Guitarist, 1903/4; traveled to Chicago, Art Institute, Feb. 17–May 13, 2007 and Paris, Musée d’Orsay, June 18–Sept. 16, 2007 (New York and Chicago only).

Chicago, Art Institute, Picasso and Chicago, Feb. 20–May 12, 2013, cat. 6 (ill.). 

Fort Worth, Kimbell Art Museum, The Age of Picasso and Matisse: Modern Masters from the Art Institute of Chicago, Oct. 6, 2013–Feb. 16, 2014, no cat. no. ",19.7591,Modern Art,Pablo Picasso,Blue period,oil on panel
9,28024,Six Busts of Women,1967.539,False,1962.0,1973.0,"May 21, 1962","Pablo Picasso
Spanish, 1881-1973",Spain,"The Art Institute of Chicago, ""Picasso in Chicago,"" February 3–March 31, 1968, pp. 89 and 117, cat. 101 (ill.).

Cambridge, Fogg Art Museum, Harvard University, ""Master Drawings by Picasso,"" 1981, p. 255, no. 26; shown only at The Art Institute of Chicago, April 29–June 14, 1981.

Art Institute of Chicago, ""Picasso and Chicago"", February 20-May 12, 2013, p. 94, cat. 228 (ill.), cat. by Stephanie d'Alessandro.",12.3099,Prints and Drawings,Pablo Picasso,Cubism,graphite
9,28019,Richard J. Daley Center Sculpture,1967.538,False,1967.0,1967.0,1967,"Pablo Picasso
Spanish, 1881-1973",Spain,"The Art Institute of Chicago, ""Picasso in Chicago,"" February 3–March 31, 1968, p. 117, cat. 102 (ill.).",59.2032,Prints and Drawings,Pablo Picasso,Cubism,chalk
9,28016,"Harpy with a Head of a Bull and Four Young Girls on a Tower Surmounted with a Black Flag, from the Suite Vollard",1967.537,False,1934.0,1934.0,December 1934,"Pablo Picasso (Spanish, 1881-1973)
printed by Roger Lacourière (French, 1892-1966)
published by Ambroise Vollard (French, 1867-1939)",Spain,,8.9451,Prints and Drawings,Pablo Picasso,Cubism,print
9,28002,"Wounded Minotaur VI, from the Suite Vollard",1967.532,False,1933.0,1933.0,"May 26, 1933, printed 1939","Pablo Picasso (Spanish, 1881-1973)
printed by Roger Lacourière (French, 1892-1966)
published by Ambroise Vollard (French, 1867-1939)",Spain,,10.5693,Prints and Drawings,Pablo Picasso,Cubism,print
9,27955,The Minotaur,1967.516,False,1933.0,1933.0,"June 24, 1933","Pablo Picasso
Spanish, 1881-1973",Spain,"New York, Museum of Modern Art, ""Modern Drawings,"" 1944, pp. 75 and 96 (ill.), as Minotaur.

Princeton, N. J., Princeton University Art Museum, ""Loan Exhibition of Picasso Drawings,"" January 10–31, 1949, cat. 30 (ill.), as The Minotaur.

New York, Museum of Modern Art, ""Picasso: 75th Anniversary Exhibition,"" May 22–September 8, 1957, p. 73 (ill.), as The Minotaur; traveled to The Art Institute of Chicago, October 29–December 8, 1957.

Philadelphia Museum of Art, ""Picasso,"" January 8–February 23, 1958, cat. 131 (ill.), as The Minotaur.

Paris, Galerie Knoedler, ""Picasso Dessins and Aquarelles,"" October–December 1966, cat. 62 (ill), as The Minotaur.

The Art Institute of Chicago, ""Picasso in Chicago,"" February 3–March 31, 1968, pp. 57 and 117, cat. 90 (ill.), as Minotaur and Woman.

The Art Institute of Chicago, ""A Quarter Century of Collecting: Drawings Given to The Art Institute of Chicago, 1944-1970 by Margaret Day Blake,"" April 28-June 7, 1970, n.p., cat. 46 (ill.).

Paris, Musée de Louvre, ""Dessins français de l’Art Institute de Chicago de Watteau à Picasso,"" October 15, 1976–January 17, 1977, pp. 82–83, cat. 82 (ill.), as The Minotaur.

Frankfurt am Main, Städtische Galerie im Städelschen Kunsinstitut, ""Französische Zeichnungen aus dem Art Institute of Chicago,"" February 10–April 10, 1977, pp. 182–183, cat. 88 (ill.), as The Minotaur.

New York, Museum of Modern Art, ""Picasso Retrospective,"" May 1–September 16, 1980, p. 312 (ill.), as Minotaur and Nude.

Cambridge, Mass., Fogg Art Museum, ""Master Drawings by Picasso,"" February 20–April 5, 1981, pp. 182–183, cat. 76 (ill.); traveled to The Art Institute of Chicago, April 29–June 14, 1981, and the Philadelphia Museum of Art, July 11–August 23, 1981.

The Art Institute of Chicago, ""Great Drawings from The Art Institute of Chicago: The Harold Joachim Years 1958–1983,"" July 24–September 30, 1985, pp. 206–207, cat. 96 (ill.).

Art Institute of Chicago, ""Picasso and Chicago"", February 20-May 12, 2013, p. 69, cat. 127 (ill.), cat. by Stephanie d'Alessandro.",8.1303,Prints and Drawings,Pablo Picasso,Cubism,pen and ink drawings
9,25809,Maquette for Richard J. Daley Center Sculpture,1966.379,False,1964.0,1964.0,1964,"Pablo Picasso
Spanish, active France, 1881–1973",Spain,"London, Tate Gallery, Picasso Sculpture, Ceramics, Graphic Work, June 9–August 13, 1967, p. 108, cat. 203 (ill.).

New York, Museum of Modern Art, The Sculpture of Picasso, October 9, 1967–January 7, 1968, pp. 206 and 225, cat. 204 (ill.).

Art Institute of Chicago, Picasso in Chicago, February 3–March 31, 1968, hors cat..

New York, Museum of Modern Art, Picasso Retrospective, May 1–September 16, 1980, p. 442 (ill.).

Milwaukee Art Museum, Controversial Public Art: From Rodin to di Suvero, October 21, 1983–January 15, 1984, p. 40, cat. 32.

New York, Whitney Museum of American Art, Picasso and American Art, September 28, 2006–January 28, 2007, pp. 254, 258, 260, pl. 133, and 387; traveled to the San Francisco Museum of Modern Art, February 25–May 28 2007, and Minneapolis, Walker Art Center, June 17–September 9, 2007.

New York, Museum of Modern Art, Picasso Sculpture, September 14, 2015–February 7, 2016; Paris, Musée Picasso, March 8-August 28, 2016.",29.7175,Modern Art,Pablo Picasso,Cubism,sculpture
9,25374,The Hare Hunters,1966.183,False,1566.0,1566.0,1566,"Pieter Bruegel, the elder
Flemish, 1525/30-1569",Netherlands,,14.7662,Prints and Drawings,"Pieter Bruegel, the elder",,etching
9,24331,Portrait of D. H. Kahnweiler III,1965.847,False,1957.0,1957.0,"June 3, 1957","Pablo Picasso (Spanish, 1881-1973)
published by Galerie Louise Leiris",Spain,,14.6905,Prints and Drawings,Pablo Picasso,Cubism,lithograph
9,24217,"The Tavern: Young Catalan Fisherman Recounting His Life to an Old Bearded Fisherman, from the Suite Vollard",1965.788,False,1934.0,1934.0,"November 29, 1934, printed and published 1939","Pablo Picasso (Spanish, 1881-1973)
printed by Roger Lacourière (French, 1892-1966)
published by Ambroise Vollard (French, 1867-1939)",Spain,,11.786,Prints and Drawings,Pablo Picasso,Cubism,etching
9,24205,Nessus and Deianira,1965.783,False,1920.0,1920.0,"September 22, 1920","Pablo Picasso
Spanish, 1881-1973",Spain,"New York, Curt Valentin Gallery, ""Pablo Picasso 1920–25,"" September 22–October 18, 1952, cat. 14, as The Centaur Nessus.

New York, Schaeffer Gallery, ""Contemporary Spanish Painting,"" January 19–February 6, 1953, cat. 40 (ill.); traveled to Barnard College.

New York, Galerie Chalette, ""Picasso - The Woman,"" April 16–May 19, 1956, cat. 10 (ill.).

New York, Museum of Modern Art, ""Picasso: 75th Anniversary Exhibition,"" May 22–September 8, 1957, p. 51 (ill.); traveled to The Art Institute of Chicago, October 29–December 8, 1957.

Philadelphia Museum of Art, ""Picasso,"" January 8–February 23, 1958, cat. 95 (ill.).

Rotterdam, The Netherlands, Museum Boymans, ""Van Clouet tot Matisse: tentoonstelling van franse tekeningen uit amerikaanse collectives,"" July 31–September 28, 1958, pp. 142 and 204, cat. 219 (ill.).

New York, The Metropolitan Museum of Art, ""French Drawings from American Collections, Clouet to Matisse,"" February 3–March 15, 1959, p. 141, cat. 219 (ill.).

Paris, Musée de l’Orangerie, ""De Clout a Matisse: Dessins Français des Collection Américaines, 1958–1959,"" cat. 219 (ill.).

Poughkeepsie, NY, Vassar College, ""Centennial Loan Exhibition,"" 1961, cat. 124 (ill.).

Fort Worth, Tex. and Dallas, Tex., The Fort Worth Art Center and the Dallas Museum of Fine Arts, ""Picasso,"" February 8–March 26, 1967, p. 103, cat. 178 (ill.).

The Art Institute of Chicago, ""Picasso in Chicago,"" February 3–March 31, 1968, pp. 57, 75, and 116–117, cat. 82 (ill.).

New York, Marlborough Gallery, ""Homage to Picasso,"" October 1971, cat. 29 (ill.).

Paris, Musée du Louvre, ""Dessins Français de l’Art Institute de Chicago de Watteau à Picasso,"" October 15, 1976–January 17, 1977, cat. 81 (ill.).

Frankfort am Main, Germany, Städtische Galerie in Städelschen Kunstinstiutut, ""Franzöische Zeichnungen aus de Art Institute of Chicago,"" February 10–April 10, 1977, pp. 180–181, cat. 87 (ill.).

New York, Museum of Modern Art, ""Pablo Picasso: A Retrospective,"" May 1–September 16, 1980, p. 226 (ill.).

Cambridge, Fogg Museum of Art, ""Master Drawings by Picasso,"" February 20–April 5, 1981, pp. 162–163, cat. 65 (ill.); traveled to The Art Institute of Chicago, April 29–June 14, 1981 and the Philadelphia Museum of Art, July 11–August 23, 1981.

The Art Institute of Chicago, ""Master Drawings from The Art Institute of Chicago: The Harold Joachim Years 1958–1983,"" July 24–September 30, 1985, pp. 204–205, cat. 95 (ill.).

Tubingen, Germany, Kunsthalle Tubingen, ""Picasso,"" April 5–May 25, 1986, cat. 105 (ill.); traveled to the Kunstsammlung Nordrhein-Westfalen, Düsseldorf.

New York, Pace Gallery, ""Je suis le cahier: The Sketchbooks of Pablo Picasso,"" 1986, hors cat.; shown only at The Art Institute of Chicago, July 10–August 23, l987.

Stockholm Moderna Museet, ""Pablo Picasso,"" October 15, 1988–January 8, 1989, cat. 187 (ill.).

Paris, Musée Picasso, ""Picasso et le Voyage d’Italie,"" March 14–July 12, 1998, cat. 211 (ill.); traveled to the Palazzo Grassi, Venice.

Art Institute of Chicago, ""Picasso and Chicago"", February 20-May 12, 2013, p. 62, cat. 68 (ill.), cat. by Stephanie d'Alessandro.",11.4566,Prints and Drawings,Pablo Picasso,Cubism,graphite
9,23968,Nude under a Pine Tree,1965.687,False,1959.0,1959.0,"January 20, 1959","Pablo Picasso
Spanish, active France, 1881-1973",Spain,"Moscow, Pavilion of Culture, French National Exhibition, August 15–September 15, 1961, cat. 48.

Houston, Museum of Fine Arts, Three Spaniards: Picasso, Miro, Chillida, February 6–March 4, 1962 (ill.).

Fredericton, New Brunswick, Canada, Beaverbrook Art Gallery, Dunn International Exhibition, September 1963, cat. 70 (ill.); traveled to The Tate Gallery, London, November 15–December 22, 1963.

Tokyo, National Museum of Modern Art, Pablo Picasso, May 23–July 5, 1964, cat. 133 (ill.) as Female Nude Under a Pine; traveled to Kyoto, National Museum of Modern Art, July 10–August 2, 1964; and Nagoya, Prefectural Museum of Art, August 7–18, 1964.

Chicago, Art Institute, Picasso in Chicago, February 3–March 31, 1968, pp. 50 and 115, cat. 54 (ill.).

Chicago, Art Institute, The Grant J. Pick Collection, June 20–August 16, 1970, p. 6–7 (ill.).

New York, Marlborough Gallery, Homage to Picasso, October 5–30, 1971, p. 88, cat. 77 (ill.).

London, The Tate Gallery, Late Picasso: Paintings, Sculpture, Drawings, Prints 1953–1972, June 23–September 18, 1988, p. 161, cat. 10 (ill.); traveled to Paris, Musée National d’Art Moderne, February 17–May 16, 1988, cat. 15 (ill.).

Berlin, Nationalgalerie, Pablo Picasso: Die Zeit nach Guernica 1937-1973, December 8, 1992–February 21, 1993, cat. 122 (ill.), as Weiblicher Akt Unter Einer Kiefer; traveled to Munich, Kunsthalle, March 11–June 6, 1993, and Hamburg, Kunsthalle, June 18–August 18, 1993.

West Palm Beach, Fla., Norton Gallery School of Art, Picasso: A Vision, March 2–April 3, 1994, pp. 20 and 49, cat. 27 (ill.).

Fort Worth, Kimbell Art Museum, The Age of Picasso and Matisse: Modern Masters from the Art Institute of Chicago, October 6, 2013–February 16, 2014, no cat. no. ",22.2907,Modern Art,Pablo Picasso,reclining,painting
9,23701,Picador and Bullfighter,1965.517,False,1959.0,1959.0,"September 8, 1959, published 1960","Pablo Picasso (Spanish, 1881-1973)
printed by Hidalgo Arnéra
published by Galerie Louise Leiris",Spain,,29.7921,Prints and Drawings,Pablo Picasso,Cubism,linocut
9,22667,Still Life with Glass Under the Lamp,1965.37,False,1962.0,1962.0,"March 19, 1962, published 1963","Pablo Picasso (Spanish, 1881-1973)
printed by Hidalgo Arnéra
published by Galerie Louise Leiris",Spain,,61.4562,Prints and Drawings,Pablo Picasso,Cubism,linocut
9,22658,Glass Under Lamp,1965.34,False,1962.0,1962.0,"1962, published 1963","Pablo Picasso (Spanish, 1881-1973)
printed by Hidalgo Arnéra
published by Galerie Louise Leiris",Spain,,18.9178,Prints and Drawings,Pablo Picasso,Cubism,linocut
9,22655,Jacqueline in Profile to the Right,1965.33,False,1958.0,1958.0,"December 27, 1958","Pablo Picasso (Spanish, 1881-1973)
published by Galerie Louise Leiris",Spain,,7.5692,Prints and Drawings,Pablo Picasso,Cubism,lithograph
9,22652,Games and Reading,1965.32,False,1953.0,1953.0,"January 23–24, 1953","Pablo Picasso
Spanish, 1881-1973",Spain,,19.3058,Prints and Drawings,Pablo Picasso,Cubism,lithograph
9,22649,The Sleeping Woman,1965.31,False,1947.0,1947.0,"March 23, 1947","Pablo Picasso
Spanish, 1881-1973",Spain,,18.4398,Prints and Drawings,Pablo Picasso,Cubism,lithograph
9,21112,"On the Beach, I (Two Nude Women), from Quatre Lithographies",1935.57,False,1921.0,1921.0,"March 8, 1921, published April 1923","Pablo Picasso (Spanish, 1881-1973)
printed by Bruant",Spain,,9.7297,Prints and Drawings,Pablo Picasso,Cubism,lithograph
9,21106,"Salomé, from The Saltimbanques",1935.55,False,1905.0,1905.0,"1905, printed and published 1913","Pablo Picasso (Spanish, 1881-1973)
printed by Louis Fort (French, 19th-20th century)
published by Ambroise Vollard (French, 1867-1939)",Spain,,21.3413,Prints and Drawings,Pablo Picasso,Cubism,drypoint
9,20558,Bust of a Woman,1964.215,False,1909.0,1909.0,late 1909,"Pablo Picasso
Spanish, 1881-1973",Spain,"Philadelphia, Pennsylvania Museum of Art, ""The Collection of Earl Horter,"" February 17–March 13, 1934, no. cat.

Chicago, The Arts Club, ""Modern Paintings from the Collection of Mr. Earl Horter of Philadelphia,"" April 3-26, 1934, n.p., cat. 47, as Watercolor Negro Period.

The Art Institute of Chicago, ""Picasso in Chicago,"" February 3–March 31, 1968, pp. 67 and 116, cat. 72 (ill.).

Kunsthalle Bielefeld, ""Zeichnungen und Collagen des Kubismus-Picasso-Braque-Gris,"" March 11–April 29, 1979, p. 267, cat. 54 (ill.).

The Art Institute of Chicago, ""Great Drawings from the Art Institute of Chicago: The Harold Joachim Years, 1958-1983,"" July–Septemper 1985, pp. 202–203, cat. 94 (ill.).

Philadelphia Museum of Art, ""Mad for Modernism: Earl Horter and His Collection,"" March 7, 1999–May 16, 1999, p. 90, cat. 33 (ill.). 

Art Institute of Chicago, ""Picasso and Chicago"", February 20-May 12, 2013, p. 47, cat. 44 (ill.), cat. by Stephanie d'Alessandro.",23.6186,Prints and Drawings,Pablo Picasso,Cubism,watercolor
9,20522,Jester,1964.193,False,1905.0,1905.0,1905,"Pablo Picasso
Spanish, active France, 1881–1973",Spain,"Chicago, Art Institute, Cézanne’s Harlequin, Feb. 26–May 30, 2011, no cat. no. (ill.).

Chicago, Art Institute, Picasso and Chicago, Feb. 20–May 12, 2013, cat. 20 (ill.), as Jester, spring 1905.",9.2981,Modern Art,Pablo Picasso,,sculpture
9,20241,Portrait of Eugenia Errazuriz,1963.415,False,1907.0,1921.0,1921,"Pablo Picasso
Spanish, 1881-1973",Spain,"The Art Institute of Chicago, ""The Grant J. Pick Collection,"" June 20–August 16, 1970, p. 9.

New York, Pace Gallery, ""Je suis le cahier: The Sketchbooks of Pablo Picasso, 1986,"" hors cat.; shown only at The Art Institute of Chicago, July 10–August 23, l987.",9.0216,Prints and Drawings,Pablo Picasso,Cubism,graphite
9,18709,"The Frugal Meal, from The Saltimbanques",1963.825,False,1904.0,1904.0,September 1904,"Pablo Picasso (Spanish, 1881-1973)
printed by Eugène Delâtre (French, 1864-1938)",Spain,,19.6415,Prints and Drawings,Pablo Picasso,Cubism,etching
9,18187,"The Three Bathers, III",1934.11,False,1923.0,1923.0,"1923, printed and published 1931","Pablo Picasso (Spanish, 1881-1973)
printed by Leblanc and Trautmann
published by Marcel Guiot (French, 1893-1977)",Spain,,11.7022,Prints and Drawings,Pablo Picasso,Cubism,etching
9,17924,"The Embrace III, from the Suite Vollard",1963.546,False,1933.0,1933.0,"April  23, 1933, printed and published 1939","Pablo Picasso (Spanish, 1881-1973)
printed by Roger Lacourière (French, 1892-1966)
published by Ambroise Vollard (French, 1867-1939)",Spain,,14.6967,Prints and Drawings,Pablo Picasso,Cubism,drypoint
9,15233,The Resurrection,1962.805,False,1575.0,1585.0,c. 1580,"Philip Galle (Flemish, 1537–1612)
after Pieter Bruegel, the Elder (Flemish, 1525/30-1569)",Netherlands,,8.9219,Prints and Drawings,"Pieter Bruegel, the elder",,engraving
9,14839,At the Cabaret,1933.527,False,1901.0,1901.0,1901,"Pablo Picasso
Spanish, 1881-1973",Spain,"Birmingham, Ala., Birmingham Museum of Art, ""Exhibition of French Drawings (Le Fin du Siècle),"" October 5–November 1, 1952, no cat.

The Art Institute of Chicago, ""Picasso in Chicago,"" Februry 3–March 31, 1968, pp. 56, 59, and 116, cat. 59, (ill.); as c. 1898–1900.

Chicago, R. S. Johnson-International Gallery, ""Homage to Picasso,"" Winter 1973, pp. 5 and 57, cat. 1, (ill.).

Princeton, N.J., The Art Museum, Princeton University, ""Els Quatre Gats: Art in Barcelona around 1900,"" January 28–March 26, 1978, pp. 98–99, cat. 28, (ill.).

Washington D.C., Hirshhorn Museum, ""Els Quatre Gats: Art in Barcelona around 1900,"" April 14–June 26, 1978.

Cambridge, Mass., Fogg Art Museum, ""Master Drawings by Picasso,"" 1981, p. 253, no. 2; shown only at The Art Institute of Chicago,  April 29–June 14, 1981. 

New York, Pace Gallery, ""Je Suis le Cahier: The Sketchbooks of Pablo Picasso,"" 1986, hors cat.; shown only at The Art Institute of Chicago, July 10–August 23, l987.

The Art Institute of Chicago, April 26, 1990-March 9, 1992.

Art Institute of Chicago, ""Picasso and Chicago"", February 20-May 12, 2013, hors cat.",22.6844,Prints and Drawings,Pablo Picasso,Cubism,crayon
